{
  "$id": "urn:ratatoskr:contracts:content:v1:Document",
  "$schema": "https://json-schema.org/draft/2020-12/schema",
  "title": "Document",
  "description": "Canonical Document IR version one.\n\nThe shape is the shared intersection between Extractor and Knowledge. Rendered Markdown,\nquality-scoring diagnostics and service-private storage fields are deliberately absent.\n\n# Content hashing\n\n`content_digest` is SHA-256 over the UTF-8 bytes of the repository's canonical JSON rendering\nof `blocks` alone. Block order, discriminants and text are significant; identity, source\naddress, title, language and provenance are not. A producer does not rewrite extracted text\nafter it enters a block.",
  "type": "object",
  "properties": {
    "blocks": {
      "description": "Typed content blocks in reading order.",
      "type": "array",
      "items": {
        "$ref": "#/$defs/DocumentBlock"
      }
    },
    "content_digest": {
      "description": "Digest of the normalized document content.",
      "$ref": "#/$defs/ContentDigest"
    },
    "document_id": {
      "description": "Stable identity assigned to the normalized document.",
      "$ref": "#/$defs/DocumentId"
    },
    "language": {
      "description": "Document language. Absent when it cannot be determined.",
      "anyOf": [
        {
          "$ref": "#/$defs/LanguageTag"
        },
        {
          "type": "null"
        }
      ]
    },
    "provenance": {
      "description": "Block-addressable evidence that identifies the stored source and extraction strategy.",
      "type": "array",
      "items": {
        "$ref": "#/$defs/DocumentProvenance"
      }
    },
    "source_address": {
      "description": "URI from which the source was acquired.",
      "$ref": "#/$defs/DocumentAddress"
    },
    "title": {
      "description": "Extracted title. Absent when the source provides no usable title.",
      "type": [
        "string",
        "null"
      ]
    }
  },
  "additionalProperties": false,
  "required": [
    "blocks",
    "content_digest",
    "document_id",
    "provenance",
    "source_address"
  ],
  "x-ratatoskr-provenance": {
    "canonical_source": "ratatoskr_document_contracts::Document",
    "contract_id": "content.document",
    "contract_major_version": 1,
    "generated": "DO NOT EDIT — generated by contractsc from the canonical Rust source. Change the Rust type and run `cargo contracts generate`.",
    "generator": "contractsc",
    "generator_version": "0.1.0",
    "schemars_version": "1.2.2",
    "source_digest": "sha256:25d64a32ac8441d4c8f0ff21db02c7db6157625c4477cedac5b2c756c934b3e3",
    "validation_note": "This schema is a LOWER BOUND on validity. Cross-field invariants and canonical-form rules are enforced by the canonical Rust type; see fixtures/invalid-expectations.toml for which layer rejects what."
  },
  "$defs": {
    "BlobOwner": {
      "title": "BlobOwner",
      "description": "Deployment identity of the service that owns and resolves a blob.",
      "type": "string",
      "examples": [
        "ratatoskr-extractor",
        "ratatoskr-vault"
      ],
      "maxLength": 64,
      "pattern": "^[a-z][a-z0-9-]{1,63}$"
    },
    "BlobRef": {
      "description": "Reference to content-addressed bytes owned by one service.\n\nThis is a reference, not a storage API. The owner writes and resolves the bytes under its own\ncontent-addressed directory. No host, filesystem path, signed URL, credentials, or expiry can\nappear in this contract.",
      "type": "object",
      "properties": {
        "digest": {
          "description": "Digest that names the bytes and lets a reader verify them.",
          "$ref": "#/$defs/ContentDigest"
        },
        "length_bytes": {
          "description": "Exact byte length of the stored value.",
          "type": "integer",
          "format": "uint64",
          "minimum": 0
        },
        "media_type": {
          "description": "Media type of the stored bytes.",
          "$ref": "#/$defs/MediaType"
        },
        "owner_service": {
          "description": "Service that owns the bytes and their lifecycle.",
          "$ref": "#/$defs/BlobOwner"
        }
      },
      "additionalProperties": false,
      "required": [
        "digest",
        "length_bytes",
        "media_type",
        "owner_service"
      ]
    },
    "ContentDigest": {
      "description": "A content digest with an explicit algorithm.",
      "type": "object",
      "properties": {
        "algorithm": {
          "description": "Hash algorithm used to produce `hex`.",
          "$ref": "#/$defs/DigestAlgorithm"
        },
        "hex": {
          "description": "Lowercase hexadecimal digest bytes.",
          "$ref": "#/$defs/DigestHex"
        }
      },
      "additionalProperties": false,
      "required": [
        "algorithm",
        "hex"
      ]
    },
    "DigestAlgorithm": {
      "description": "Algorithm used to calculate a content digest.",
      "oneOf": [
        {
          "description": "SHA-256.",
          "type": "string",
          "const": "sha256"
        }
      ]
    },
    "DigestHex": {
      "title": "DigestHex",
      "description": "Lowercase hexadecimal bytes of a content digest.",
      "type": "string",
      "examples": [
        "0000000000000000000000000000000000000000000000000000000000000000"
      ],
      "maxLength": 64,
      "pattern": "^[0-9a-f]{64}$"
    },
    "DocumentAddress": {
      "title": "DocumentAddress",
      "description": "URI from which the document was extracted.",
      "type": "string",
      "examples": [
        "document:fixture-source"
      ],
      "maxLength": 2048,
      "pattern": "^[a-z][a-z0-9+.-]{1,31}:[^ \\x09-\\x0d]{1,2015}$"
    },
    "DocumentBlock": {
      "description": "One typed block in document reading order.",
      "oneOf": [
        {
          "description": "A section heading.",
          "type": "object",
          "properties": {
            "kind": {
              "type": "string",
              "const": "heading"
            },
            "level": {
              "description": "Source heading level.",
              "type": "integer",
              "format": "uint8",
              "maximum": 255,
              "minimum": 0
            },
            "text": {
              "description": "Heading text.",
              "type": "string"
            }
          },
          "additionalProperties": false,
          "required": [
            "kind",
            "level",
            "text"
          ]
        },
        {
          "description": "A paragraph of prose.",
          "type": "object",
          "properties": {
            "kind": {
              "type": "string",
              "const": "paragraph"
            },
            "text": {
              "description": "Paragraph text.",
              "type": "string"
            }
          },
          "additionalProperties": false,
          "required": [
            "kind",
            "text"
          ]
        }
      ]
    },
    "DocumentId": {
      "title": "DocumentId",
      "description": "Identity of one normalized document. Bare canonical lowercase hyphenated UUID; not namespaced.",
      "type": "string",
      "format": "uuid",
      "examples": [
        "018f0000-0000-7000-8000-000000000001"
      ],
      "pattern": "^[0-9a-f]{8}-[0-9a-f]{4}-[0-9a-f]{4}-[0-9a-f]{4}-[0-9a-f]{12}$"
    },
    "DocumentProvenance": {
      "description": "Evidence for how and from which stored bytes a document was extracted.",
      "type": "object",
      "properties": {
        "block_index": {
          "description": "Zero-based index of the block this evidence describes.",
          "type": "integer",
          "format": "uint32",
          "minimum": 0
        },
        "extraction_strategy": {
          "description": "Strategy that produced the normalized blocks.",
          "$ref": "#/$defs/ExtractionStrategy"
        },
        "source_blob": {
          "description": "Content-addressed raw source owned by the extracting service.",
          "$ref": "#/$defs/BlobRef"
        }
      },
      "additionalProperties": false,
      "required": [
        "block_index",
        "extraction_strategy",
        "source_blob"
      ]
    },
    "ExtractionStrategy": {
      "title": "ExtractionStrategy",
      "description": "Extraction strategy that produced the normalized blocks.",
      "type": "string",
      "examples": [
        "semantic_article",
        "readability"
      ],
      "maxLength": 64,
      "pattern": "^[a-z][a-z0-9_]{0,63}$"
    },
    "LanguageTag": {
      "title": "LanguageTag",
      "description": "BCP 47 language tag asserted for the document.",
      "type": "string",
      "examples": [
        "en",
        "en-US"
      ],
      "maxLength": 63,
      "pattern": "^[A-Za-z]{2,8}(-[A-Za-z0-9]{1,8})*$"
    },
    "MediaType": {
      "title": "MediaType",
      "description": "Internet media type of stored bytes, without parameters.",
      "type": "string",
      "examples": [
        "text/html",
        "application/pdf"
      ],
      "maxLength": 255,
      "pattern": "^[a-z0-9][a-z0-9!#$&^_.+-]{0,126}/[a-z0-9][a-z0-9!#$&^_.+-]{0,126}$"
    }
  }
}
